Rate,Date,Content
5,2-Sep-20,"Just what I wanted for my granddaughter for Christmas, at exactly the price I was willing to pay. Thank you, Walmart for having it in stock. Another major retailer had it advertised at this price, but had none of them available the day the flyer came out. It was exactly as advertised, and was shipped/delivered super quickly (I had it 2 days after I ordered it). Thank you. Thank you. Thank you!"
1,2-Sep-20,I purchased this as a gift. Be careful of the 15 day return policy. I missed it by just a few days snd found myself needing to sell if on my own. I will definetly pay attdntiln to marketplace sellers in the future!
5,2-Sep-20,"Love this system. Longer battery life than the original, super fun software library, and snazzy neon colors. So glad we got a second system--now I don't have to share with my husband."
5,2-Sep-20,Everything was intact and this was the best price for the console! They are hard to find but they are definitely worth it to pass the time and play all of the nintendo exclusives
5,3-Sep-20,"This a great system, the graphics looks great and the set up was really easy. Nintendo has made many 'must play' games from well known franchises like Mario Brothers, and Legend of Zelda. There is also amazing RPG games, small independent games, horror, you name it. I played the original Nintendo when I was a little kid in the early 80s and it's been a great ride! Highly recommend!"
5,3-Sep-20,"The kids love this. They play the same games over and over, but they love the different options of joysticks. The ability to all play at the same time is also a super plus. It is a pretty cool concept to be able to use a handheld and switch to a console while also being able to play with other players. The downside is that you have to buy multiple consoles if you want each kid to be able to play on their own. I was told that the ""Lite"" version can't be connected like the console can, so the cheaper option isn't necessarily better. I have played it and I also like the Switch, mostly because they have Zelda."
5,3-Sep-20,"You'll need to buy a screen protector to be safe, but it isn't expensive. Loading takes some time with different games, updates, and downloads (depending on your internet connection), but I 100% love my switch."
5,3-Sep-20,My 4 year old Grandson loves it! He is way ahead of me. We play for hours. Some of the games allow for 4 players. Good family time.
4,3-Sep-20,My son loves it. Everything was well package and couldn't wait foot the games to come. Arrived faster than I thought.
5,4-Sep-20,"If you have always dreamed of having a console on the go, this is it. Not only can you play games handheld on the go, but hooking it up to a TV for group play is awesome. A little pricey, but if you can't wait for the new one go ahead and get this one."
5,4-Sep-20,"I recently bought this for my daughter for her bday . I could not find it anywhere and when I looked again , Walmart happened to have it in stock ! Great waiting time , and arrived on time !"
5,6-Sep-20,"very fun games, but the screen is not as good or sharp as the xbox nor ps4, owell nintendo is nintendo, their games are fun and family friendly. very solid system."
5,8-Sep-20,"These official Nintendo controllers are more expensive than knockoff ones...but considering their quality its really worth it. Also, buy these in-person at a Walmart. Walmart's online price is almost $10 more."
4,8-Sep-20,"Ordered a nintendo switch from this seller, and I'm enjoying it! It was a bit overpriced, but switches are sold out nearly everywhere else so it was worth it."
2,8-Sep-20,"So sad, we are disappointed, thought the switch would work for us just like for other people that left 5 stars reviews, however it didn't worked for us, sometimes the screen friezes.. gave 2 stars because company refunded money without any issues."
5,9-Sep-20,"I have only played Mario Odyssey so far, but the system is really fun to play. I like the controllers and the different options I have in using them. The the system is sleek and easy to use."
5,10-Sep-20,"arrived in timely fashion. apparently, the price was marked up approximately $90 due to the unavailability of the product. I was very happy to receive it regardless."
5,11-Sep-20,"Came faster than expected, brand new, no problems. Pricy, but its expected considering its sold out almost everywhere else. Definitely recommend!"
5,14-Sep-20,12-year-old daughter loves the in tendo switch plays it constantly have four games for it now wish I could get another one at the price I got this one instead of the three
5,14-Sep-20,Perfect for fun singleplayer and multiplayer! You wont regret this purchase!
5,16-Sep-20,This was a great buy and much better price then others out there priced at $500-$600
5,17-Sep-20,Online ordering is quick and easy my item came in less than a week. Your able to have multiplayers up to 8 the whole family can play together . I love it. Additional controls are pricy but worth it.
4,17-Sep-20,Both Joy-Con are loosely when attach to the Switch. I don't like that feeling when I just use the switch alone instead of attached to the console. I know one of this day that I will have to get another set of Joy-Con.
1,17-Sep-20,"Ordered online and they canceled it, but they unit is still postes as available in a higher price. This is unbelievable not even worth 1 star."
2,18-Sep-20,The product is great. But for shipping and handling service was terrible. I tracked it both through Walmart and fed-ex. My packages was stuck in a facility for 3 days. Called fedex asked if I could go pick it up. Walmart would have been no help but I would have loved if they could have updated what was going on with my package. Or in the future switch to ups or something other then Fedex
5,18-Sep-20,"What is there not to like? I've had the Xbox 1 and the PS4 since they came out but put off on buying the Switch when it came out. I cannot play first person shooter games, it literally makes me sick. With so many games coming out that are first person I have recently ran out of options of things to play besides my old standbys. We had to drive 2 hours to get this because evidently there are some greedy jerks out there who buy all the stock and then resale for a profit. Unfortunately for me and them both I'm stingy. I still have less in gas and the console than I would have paid the inflated price. Jerks. Back to the console. I travel for work so I like that I can take the system with me and pass the time when I know I'm going to be waiting, it beats trying to read things on my phone. I really like that I can charge the controllers on the console itself and don't have to buy a separate stand that is going to be finicky about charging if they're not on there just so. I'm a bit behind on games but I'm not having any trouble finding titles to play that I enjoy."
5,18-Sep-20,It was a bit pricy but well worth the money. My nieces loved playing with it. It even came a day earlier than expected.
5,18-Sep-20,This is a Christmas present for my grandson who I know will absolutely love it
5,18-Sep-20,Came on time. Great price
5,20-Sep-20,"Lots of fun, easy to navigate menus, and a great selection of games make this a must have console. Be prepared to spend a lot on accessories and games."
4,20-Sep-20,Great game system for the entire family. Do your research before buying. There seems to be an increase in price for this system due to the pandemic.
5,20-Sep-20,This is a gift for my son so I'm not sure how well this specific system is but my older son got his last year and it's been perfect. Just make sure you get a screen protector.
5,20-Sep-20,It's a Christmas present. Haven't opened yet so cant rate it. I'm sure its fantastic
5,21-Sep-20,"Greatness comes for those who wait, and that's getting this item at retail price. It performs well, great library of games, a portable system that can be played on your tv as a regular console. Nintendo products never fall short of being excellent thus they are in high demand for a reason. This is the console to get, it will be highly collectable over time, and will never loose value. Get one at retail and do your hunting like i did. Its so worth it."
5,22-Sep-20,Love it. Been trying for months to get one. This thing is beast compared to my Switch Lite. Love the bigger screen and the docobility option. The joycons are even nicer in person.
5,22-Sep-20,Perfect! The wait was well worth it! Thank you Walmart for having it in stock to order online and having the ability to pick it up at my local Walmart store.
5,22-Sep-20,Worked really well arrived super fast
5,23-Sep-20,Pickup was super easy and everything was exactly the way it was supposed to be. Nothing was damaged and it plays beautifully! Such a fun console too! I love that it can change from at home/TV gameplay to on-the-go! Very convenient
5,25-Sep-20,The item is sold at its regular price. Unlike some who jack up the price. Look for - Sold and shipped by Walmart - as these are fulfilled by vendor wherein prices are regulated by Walmart.
5,26-Sep-20,"I got this as a gift for my oldest son he loved it so much i had to buy another one for my younger son, the games are on the pricey side but they enjoy this system very much. versatile and fast shipping I would recommend."
5,27-Sep-20,"I am enjoying this console very much! My only issue was not with seller but with the company. There was no set up instructions in the box. It was fairly easy to figure out, but still would have been better with set up instructions. Shipping was fast. I received it two days ahead of when it was due. I am very pleased with this purchase."
1,27-Sep-20,Bought this a couple months ago..everything was fine for a little bit now the blue joystick doesn't work and makes the game/player go in various directions. Have to recalibrate it multiple times each time I play. Very disappointing
5,28-Sep-20,"SUCH a good family game system. Great combination of portability, indie games through the shop, and of course excellent 1st-party Nintendo games. It's really the full package."
3,28-Sep-20,There isn't much instructions that come with each game that explain in more detail about how to use the controllers. It gets a little confusing about which buttons does what function for each game. The games themselves are interesting though.
1,28-Sep-20,The switch is great. Walmart is total garbage. Go elsewhere and stop supporting this immoral corporation
5,28-Sep-20,Gave this as a gift. I received the package in a box and everything came with it. Just as described. No complaints.
5,29-Sep-20,Brand new. Arrived very well packaged. Arrived a full week before it was scheduled to!!
5,29-Sep-20,"awesome my kids love it so much we bought 2 more for the kids. That way they can play without waiting on the other to finish. They love Heave go, Fortnite and Animal crossing. Give it a 5 star because I love hearing the kids have fun. Its compact with easy to hold controllers. Great price too."
3,29-Sep-20,The Switch requires newer Wi-Fi technology for it to properly connect to the Internet. The controllers will only last 6 months I believe. The individual games are pricey so be prepared to melt your CC.
5,29-Sep-20,"received item as advertised ""new nintendo switch"" delivered as scheduled no issues at all. I would recommend seller"
4,29-Sep-20,"Its a great system! My only complaint is controller drift. I thought that Nintendo had fixed this problem, apparently not."
5,29-Sep-20,"Ordered this for my son's birthday! It came sooner than expected! Walmart was the only place that had it in stock at the time, what a life saver!"
5,30-Sep-20,"I can't make heads or tails of this thing and beyond plugging it in, can do little with it. Fortunately for me I have a 12 year old who is willing to pilot the device. He and his friends enjoy it very much. The graphics, I am told, are excellent, the game play appears to evoke much smiling and excitement, and on long car rides, ""are we there yet?"" has been replaced with soothing silence. Highly recommend this device."
5,30-Sep-20,"Endless entertainment. If you are considering purchasing, I recommend going for it! Package came securely wrapped and in perfect condition. We have not been able to put it down - great for single player and multi player alike."
5,30-Sep-20,One of the few places that have this in stock! Ordered it on line and receive it in 2 days! Much quicker than Amazon! And at a lower price.
5,2-Oct-20,"I had been waiting for this to be restocked, as I wasn't going to pay the marked up price in the $300 range when they normally are around $299. I LOVE my Nintendo Switch Lite, so I thought I'd get the original system for more options. I wasn't disappointed. Plus it lets me play games like those in the Mario series (which I haven't played in YEARS) and Just Dance, which I LOVE for multiple reasons. A item. Only complaint is minor, as I had a bit of a delay in delivery and then we had Hurricane Laura which delayed me using it."
5,2-Oct-20,Switch works great and Walmart's delivery was fast and secure. Am so glad I was finally able to get my hands on one for retail price. Recommend anyone to order online from here.
5,2-Oct-20,Item was received intact and good condition.
5,2-Oct-20,Good console for everyone. A lot of games for kids and family fun
5,5-Oct-20,"Nintendo has done a great job creating a unique platform. It's great to see reinventions of old games along with many new creations. The games are a bit pricey, but that's how all game platforms are. This is sure to bring hours of entertainment."
4,6-Oct-20,It does not come with a game. There is not enough space to download games so make sure to buy the sandisk card meant for Nintendo switch. Do not buy a 1 terabyte it will destroy your game.
4,7-Oct-20,I like the short period on time it took to receive My order. I would recommend Walmart to all my family and friends.
2,7-Oct-20,Is this a new switch or refurbished
1,8-Oct-20,"I was so excited to see these back in stock. I ordered it without hesitation. Then after going to Walmart and seeing that they were in stock there also I purchased it for $100 cheaper, I understand Walmart collabs with companies but that is ridiculous, I sent it back. But the Swith itself is great. Just becareful on prices."
4,8-Oct-20,"Quick shipping, well packed. The console is easy to setup and use and fun to play. Games are pricey, but I expected that. There are some ""bargain"" games available, so you could get hours of gaming pretty cheap if you wanted, but if you want to play the big name games (Kart, Party, Smash Bros, Animal Crossing, Zelda, etc.), you gotta shell out $60 a game. What really ticked me off was the $5 a month charge to play online. I bought the console for playing with my family remotely, since, thanks to COVID, we don't see each other often, so I pretty much had to pay the reoccurring charge for this service. Considering the price of the console, then the games, then extra controllers, etc etc this extra charge is ridiculous. After buying just two games, I'm $420 into this console already, now I have to pay $60 a year? I knocked off a star for that."
5,9-Oct-20,"Nice console for children As an adult, I would not buy it for myself as most games are pretty primitive. But kids love it. I love them loving it because they don't sit in one place but rather constantly moving"
4,9-Oct-20,Great item. Came with everything but did not feel brand new. Felt like packaging was for refurbished item
5,10-Oct-20,I love the Switch. This is my second one. First one still works. I just wanted two. Great game system. I thought the screen would be too small to enjoy playing games on...I was wrong.
5,14-Oct-20,"very fun games, but the screen is not as good or sharp as the xbox nor ps4, owell nintendo is nintendo, their games are fun and family friendly. very solid system."
5,17-Oct-20,"My girlfriend had wanted one of these for a very long time, and I noticed all the amazon switches were sold with a UK version of the AC adapter, so I looked on walmart. I was a bit worried that the package wouldn't be handled carefully given the other reviews, but when I got it within 2 days I was really happy. Fully functional, no issues, super fast delivery. Very happy overall"
5,17-Oct-20,Exactly what I ordered! Also got delivered a day earlier than expected.
1,20-Oct-20,It was broken when it arrived have had it charging for 3 hours now still will not power up at all screen has scratches in it looks refurbished supposed to be new very disappointed as it was a gift for my daughter..pretty devastated as a dad who promised his baby girl this...now the company I guess Wal-Mart went through to get this is making it difficult to return
5,21-Oct-20,This is a Xmas gift so I only Checked to make sure that nothing was damaged My grandchildren already have one and love it
4,21-Oct-20,My kids love it and having non stop fun. My younger one is juz 5 years old and she is able to learn quickly . GREAT PRODUCT
1,21-Oct-20,I didn't have it for too long and it's already having problems not charging
4,22-Oct-20,"very fun games, but the screen is not as good or sharp as the xbox nor ps4, owell nintendo is nintendo, their games are fun and family friendly. very solid system."
4,22-Oct-20,i love the machine very much! it's fun to play with kids and it can install bunch of games through downloading using wifi. and the mario cart is a legend. we can play it all day.
3,22-Oct-20,Pretty large for younger smaller hands. Glorified game boy at a much higher price. It is good if you have an Extra $300 or you play games 24 /7 but I bought as a gift. I am hoping that this most expensive gift is worth it.
4,22-Oct-20,Fun to play with family and online. Just unfortunate they don't have as many main stream games as the other consoles do.
5,22-Oct-20,e all love playing the switch..its fun for all ages and its portability makes it fun on the go as well
5,22-Oct-20,Very easy to set and begin playing immediately.
5,22-Oct-20,Much cheaper than on Amazon!
5,23-Oct-20,Came in a reasonable time
5,24-Oct-20,Good game. My 8 years old love it
5,24-Oct-20,I like that the $299.00 set has everything you need to get started
1,25-Oct-20,The box did not connect to TV. I had to send it back and I am still waiting on refund. The serial numbers on box and console did not match so that was another headache. Walmart can do better.!
5,25-Oct-20,"I got this for work as a hand held system to play during slow times. And it has been great. Its easy to use, great graphics and games."
5,25-Oct-20,Got an amazing deal and especially when it was out of stock everywhere I got it for a very discounted price
5,25-Oct-20,Love the Nintendo Switch. Easy to set up and easy to use
5,25-Oct-20,This is a gift and I loved fast shipping and price Im sure he will love it
1,25-Oct-20,Less than one year old and wont work
5,26-Oct-20,"I first bought a Switch when it came out, but wasn't playing it much so I gave it to my daughters. Then, in March 2020, we had this thing called a pandemic happen, and we all had to shelter in place to a few months. So I looked into buying one again to pass the time. It was sold out everywhere, and when you DID find one, it was marked up 150%, Amazon, eBay, you name it. After being persistent, I found it at Walmart at the MSRP. Glad, now I have something to do beside watch TV all day."
5,26-Oct-20,"I bought this unit for my wife and she seems to love it. I myself am not a gamer, but she's an enthusiastic player, so I guess I would recommend this unit based on her level of enjoyment!"
4,27-Oct-20,"Likes: -Able to play on Nintendo Switch console, or connect console to TV with HDMI, and play watching the screen of TV -HDMI included -Joy cons allow more than one person to play Minor Dislikes: -There are not many games capable for the use of the joy cons"
5,27-Oct-20,"I love my new switch, Im glad I bought it, and Im also really glad I was able to get it in my favorite color :"
5,27-Oct-20,Real fun game system. My son loves it.
1,27-Oct-20,I bought this and it said they had it and they just canceled it last second
5,28-Oct-20,Make sure you buy a memory card with it
5,28-Oct-20,Finally got one after the shortage of 2020. As expected. Great fun
4,28-Oct-20,"I'm very satisfied and I have no complaints about this console, I would recommend it to anyone"
1,1-Nov-20,The product model is not the same as what is listed on the product description
5,1-Nov-20,Arrived on time and was exactly what we wanted
5,2-Nov-20,"It was delivered on time and even a few days earlier than expected. My son was super thrilled for his gift. He had played friends' consoles and loved the switch for its ease of travel and switching to a tv at home. The games are a little expensive as most are, but overall very happy with the product."
5,2-Nov-20,Nintendo has a good selection of games that are less killing type of games. I choose this for the variety of non violence games you can offer the kids.
5,3-Nov-20,Gift for my daughter who LOVES it!
5,5-Nov-20,A great console for the kids and you can play in any place as long as you have battery
5,6-Nov-20,My Whole Family loves this item and it is a great gift
5,7-Nov-20,It's a fun console I play smash bros ultimate on it and it's an amazing experience very fun
5,8-Nov-20,this is amazing just buy this already
5,9-Nov-20,Love playing on this with m grandchildren. My grandson set it up. Was easy for a teenager to do
5,10-Nov-20,My kid is so happy! Animal Crossing on the switch is a winner!
5,11-Nov-20,Came in perfect condition and came very fast
5,12-Nov-20,"I love my Nintendo switch Lite. But I decided that I love it so much I would get the regular switch. Everything works amazing, it came with the HDMI cable, power cable, the dock, two straps for the joycons, you also got the joycon controller with it. I do definitely recommend this. But it is a little bit more pricier."
5,13-Nov-20,"So far ,so good !!! My kids waiting a long time for this Nintendo and finally they got it .Arrived 6 day before expected and is Brand New ."